<?xml version="1.0" encoding="UTF-8"?>
<!DOCTYPE list SYSTEM "../templates/zones.dtd">
<list>
  <zone id="1" type="Script" name="Emerald Square Secret Door 1 (Ram)">
    <settings questZoneId="100000"/>
    <shape type="Poly" zMin="-12000" zMax="-11700">
      <point x="143621" y="142741"/>
      <point x="143720" y="142751"/>
      <point x="143719" y="142764"/>
      <point x="143619" y="142758"/>
    </shape>
  </zone>
  <zone id="2" type="Script" name="Emerald Square Secret Door 2">
    <settings questZoneId="100001"/>
    <shape type="Poly" zMin="-12000" zMax="-11700">
      <point x="144088" y="142435"/>
      <point x="144086" y="142500"/>
      <point x="144070" y="142492"/>
      <point x="144074" y="142425"/>
    </shape>
  </zone>
  <zone id="3" type="Script" name="Emerald Square Secret Door 3">
    <settings questZoneId="100002"/>
    <shape type="Poly" zMin="-12500" zMax="-12000">
      <point x="147791" y="143766" />
      <point x="147802" y="143683" />
      <point x="147817" y="143685" />
      <point x="147804" y="143769" />
    </shape>
  </zone>
  <zone id="4" type="Script" name="Emerald Square Secret Door 4">
    <settings questZoneId="100003"/>
    <shape type="Poly" zMin="-12300" zMax="-12200">
      <point x="149224" y="143694"/>
      <point x="149279" y="143772"/>
      <point x="149272" y="143785"/>
      <point x="149212" y="143705"/>
    </shape>
  </zone>
</list>
