<?xml version="1.0" encoding="UTF-8"?>
<!DOCTYPE list SYSTEM "../templates/zones.dtd">
<!--
  The effect of these zones is only applied during siege.
  The strength of the effect depends on the adena invested (lvl 1-4).
  The zones affect both attackers and defenders.
  The zones are set up via Chamberlain; when Flame Control Tower dies during siege, the zones cease working.
  During siege, always show the danger area.
-->
<!--
  Smaller castles have _i (inner) and _o (outer), 
  while larger have _e (east) and _w (west),
-->
<list>
  <!-- Gludio -->
  <zone id="1" name="gludio_slow_damage_i" type="SiegeDanger">
    <entity castleId="1"/>
    <settings abnormal="4000" hpDamage="200" mpDamage="100"/>
    <shape type="Rect" zMin="-2650" zMax="-2550">
      <point x="-18250" y="110800"/>
      <point x="-17970" y="111175"/>
    </shape>
  </zone>
  <zone id="2" name="gludio_slow_damage_o" type="SiegeDanger">
    <entity castleId="1"/>
    <settings abnormal="4000" hpDamage="200" mpDamage="100"/>
    <shape type="Rect" zMin="-2570" zMax="-2400">
      <point x="-19215" y="107390"/>
      <point x="-18830" y="107120"/>
    </shape>
  </zone>

  <!-- Dion -->
  <zone id="3" name="dion_slow_damage_i" type="SiegeDanger">
    <entity castleId="2"/>
    <settings abnormal="4000" hpDamage="200" mpDamage="100"/>
    <shape type="Rect" zMin="-2760" zMax="-2700">
      <point x="22215" y="158950"/>
      <point x="21930" y="158575"/>
    </shape>
  </zone>
  <zone id="4" name="dion_slow_damage_o" type="SiegeDanger">
    <entity castleId="2"/>
    <settings abnormal="4000" hpDamage="200" mpDamage="100"/>
    <shape type="Rect" zMin="-2780" zMax="-2500">
      <point x="23170" y="162350"/>
      <point x="22785" y="162615"/>
    </shape>
  </zone>

  <!-- Giran -->
  <zone id="5" name="giran_slow_damage_i" type="SiegeDanger">
    <entity castleId="3"/>
    <settings abnormal="4000" hpDamage="200" mpDamage="100"/>
    <shape type="Rect" zMin="-2640" zMax="-2570">
      <point x="115115" y="145000"/>
      <point x="114745" y="145235"/>
    </shape>
  </zone>
  <zone id="6" name="giran_slow_damage_o" type="SiegeDanger">
    <entity castleId="3"/>
    <settings abnormal="4000" hpDamage="200" mpDamage="100"/>
    <shape type="Rect" zMin="-2635" zMax="-2500">
      <point x="118540" y="144000"/>
      <point x="118775" y="144380"/>
    </shape>
  </zone>

  <!-- Oren -->
  <zone id="7" name="oren_slow_damage_i" type="SiegeDanger">
    <entity castleId="4"/>
    <settings abnormal="4000" hpDamage="200" mpDamage="100"/>
    <shape type="Rect" zMin="-2335" zMax="-2370">
      <point x="80725" y="37055"/>
      <point x="81200" y="37330"/>
    </shape>
  </zone>
  <zone id="8" name="oren_slow_damage_o" type="SiegeDanger">
    <entity castleId="4"/>
    <settings abnormal="4000" hpDamage="200" mpDamage="100"/>
    <shape type="Rect" zMin="-2370" zMax="-2200">
      <point x="84590" y="36080"/>
      <point x="84860" y="36485"/>
    </shape>
  </zone>

  <!-- Aden -->
  <zone id="9" name="aden_slow_damage_1w" type="SiegeDanger">
    <entity castleId="5"/>
    <settings abnormal="4000" hpDamage="200"/>
    <shape type="Rect" zMin="-496" zMax="-296">
      <point x="145548" y="6669"/>
      <point x="145813" y="6804"/>
    </shape>
  </zone>
  <zone id="10" name="aden_slow_damage_2w" type="SiegeDanger">
    <entity castleId="5"/>
    <settings abnormal="4000" hpDamage="200"/>
    <shape type="Rect" zMin="-496" zMax="-296">
      <point x="145548" y="6797"/>
      <point x="145813" y="6932"/>
    </shape>
  </zone>
  <zone id="11" name="aden_slow_damage_3w" type="SiegeDanger">
    <entity castleId="5"/>
    <settings abnormal="4000" hpDamage="200"/>
    <shape type="Rect" zMin="-496" zMax="-296">
      <point x="145548" y="6925"/>
      <point x="145813" y="7060"/>
    </shape>
  </zone>
  <zone id="12" name="aden_slow_damage_4w" type="SiegeDanger">
    <entity castleId="5"/>
    <settings abnormal="4000" hpDamage="200"/>
    <shape type="Rect" zMin="-528" zMax="-328">
      <point x="145548" y="7053"/>
      <point x="145813" y="7188"/>
    </shape>
  </zone>
  <zone id="13" name="aden_slow_damage_1e" type="SiegeDanger">
    <entity castleId="5"/>
    <settings abnormal="4000" hpDamage="200"/>
    <shape type="Rect" zMin="-528" zMax="-328">
      <point x="149084" y="6685"/>
      <point x="149349" y="6820"/>
    </shape>
  </zone>
  <zone id="14" name="aden_slow_damage_2e" type="SiegeDanger">
    <entity castleId="5"/>
    <settings abnormal="4000" hpDamage="200"/>
    <shape type="Rect" zMin="-528" zMax="-328">
      <point x="149084" y="6813"/>
      <point x="149349" y="6948"/>
    </shape>
  </zone>
  <zone id="15" name="aden_slow_damage_3e" type="SiegeDanger">
    <entity castleId="5"/>
    <settings abnormal="4000" hpDamage="200"/>
    <shape type="Rect" zMin="-528" zMax="-328">
      <point x="149084" y="6941"/>
      <point x="149349" y="7076"/>
    </shape>
  </zone>
  <zone id="16" name="aden_slow_damage_4e" type="SiegeDanger">
    <entity castleId="5"/>
    <settings abnormal="4000" hpDamage="200"/>
    <shape type="Rect" zMin="-560" zMax="-360">
      <point x="149084" y="7069"/>
      <point x="149349" y="7204"/>
    </shape>
  </zone>

  <!-- Innadril -->
  <!-- Retail zones have 30k+ zMax, which is foolish -->
  <zone id="17" name="innadrile_slow_damage_i" type="SiegeDanger">
    <entity castleId="6"/>
    <settings abnormal="4000" hpDamage="200"/>
    <shape type="Rect" zMin="-917" zMax="-717">
      <point x="116166" y="247739"/>
      <point x="115883" y="247355"/>
    </shape>
  </zone>
  <zone id="18" name="innadrile_slow_damage_o" type="SiegeDanger">
    <entity castleId="6"/>
    <settings abnormal="4000" hpDamage="200"/>
    <shape type="Rect" zMin="-885" zMax="-685">
      <point x="117124" y="251392"/>
      <point x="116738" y="251125"/>
    </shape>
  </zone>

  <!-- Goddard -->
  <zone id="19" name="godad_slow_damage_e" type="SiegeDanger">
    <entity castleId="7"/>
    <settings abnormal="4000" hpDamage="200"/>
    <shape type="Poly" zMin="-1789" zMax="-1489">
      <point x="149235" y="-47768"/>
      <point x="149579" y="-47608"/>
      <point x="149515" y="-47472"/>
      <point x="149169" y="-47634"/>
    </shape>
  </zone>
  <zone id="20" name="godad_slow_damage_w" type="SiegeDanger">
    <entity castleId="7"/>
    <settings abnormal="4000" hpDamage="200"/>
    <shape type="Poly" zMin="-1789" zMax="-1439">
      <point x="145352" y="-47607"/>
      <point x="145696" y="-47768"/>
      <point x="145760" y="-47633"/>
      <point x="145415" y="-47471"/>
    </shape>
  </zone>

  <!-- FIXME: Verify sides! -->
  <zone id="21" name="rune_slow_damage_e" type="SiegeDanger">
    <entity castleId="8"/>
    <settings abnormal="4000" hpDamage="200"/>
    <shape type="Poly" zMin="500" zMax="900">
      <point x="14089" y="-47869"/>
      <point x="14205" y="-47704"/>
      <point x="13899" y="-47465"/>
      <point x="13792" y="-47637"/>
    </shape>
  </zone>
  <zone id="22" name="rune_slow_damage_w" type="SiegeDanger">
    <entity castleId="8"/>
    <settings abnormal="4000" hpDamage="200"/>
    <shape type="Poly" zMin="500" zMax="900">
      <point x="13794" y="-50658"/>
      <point x="13897" y="-50839"/>
      <point x="14204" y="-50610"/>
      <point x="14068" y="-50449"/>
    </shape>
  </zone>

  <!-- FIXME: Verify sides! -->
  <zone id="23" name="schtgart_slow_damage_e" type="SiegeDanger">
    <entity castleId="9"/>
    <settings abnormal="4000" hpDamage="200"/>
    <shape type="Poly" zMin="-50" zMax="200">
      <point x="79694" y="-151664"/>
      <point x="79320" y="-151841"/>
      <point x="79320" y="-151694"/>
      <point x="79661" y="-151504"/>
    </shape>
  </zone>
  <zone id="24" name="schtgart_slow_damage_w" type="SiegeDanger">
    <entity castleId="9"/>
    <settings abnormal="4000" hpDamage="200"/>
    <shape type="Poly" zMin="-50" zMax="200">
      <point x="75477" y="-151519"/>
      <point x="75410" y="-151660"/>
      <point x="75801" y="-151840"/>
      <point x="75865" y="-151700"/>
    </shape>
  </zone>
</list>